{"schema_version":"1.0","slug":"uswds","name":"U.S. Web Design System","source_name":"U.S. Web Design System","source_url":"https://designsystem.digital.gov/","source_kind":"public-design-system","studied_at":"2026-08-30","platforms":["web","responsive-web","mobile"],"product_types":["design-system","forms","content-heavy","workflow","onboarding"],"industries":["government"],"archetypes":["federal-accessible"],"density":"medium","color_modes":["light"],"interaction_complexity":"medium","evidence_quality":"high","publication_status":"review","rights_basis":"original-analysis-public-source","summary":"A federal service system centered on accessible, mobile-friendly public experiences, reusable components, design tokens, and patterns that keep user needs and clear next actions visible across complex government journeys.","signature_traits":["accessible federal service patterns","mobile-first public usability","clear next-action hierarchy","tokenized components","continuity across multi-step journeys"],"best_for":["public-sector services","benefits and application flows","content-heavy government sites","mobile-friendly forms and multi-step journeys"],"avoid_for":["highly expressive entertainment marketing","expert-only technical workbenches where service guidance would create unnecessary handholding"]}
