{"schema_version":"1.0","slug":"material-3","name":"Material 3","source_name":"Material Design 3","source_url":"https://m3.material.io/","source_kind":"public-design-system","studied_at":"2026-08-30","platforms":["android","mobile","cross-platform"],"product_types":["design-system","native-app"],"industries":["technology","general"],"archetypes":["adaptive-expressive"],"density":"adaptive","color_modes":["adaptive","brand-variable"],"interaction_complexity":"high","evidence_quality":"high","publication_status":"review","rights_basis":"original-analysis-public-source","summary":"An adaptive and expressive system built from semantic color roles, a named type hierarchy, shape, and component theming that can change character without losing structural consistency.","signature_traits":["tonal semantic color roles","named type scale from display to label","theme subsystems for color typography and shape","expressive component shape","adaptive personalization"],"best_for":["Android products","cross-platform systems that need strong theming","consumer products where color and shape carry identity"],"avoid_for":["products that copy the baseline purple palette without brand reasoning","dense technical tools where oversized expressive surfaces reduce usable information density"]}
