{
  "schema_version":"1.0","slug":"apple-hig","name":"Apple Human Interface Guidelines","source_name":"Apple Human Interface Guidelines","source_url":"https://developer.apple.com/design/human-interface-guidelines/","source_kind":"public-design-system","studied_at":"2026-08-30","platforms":["ios","mobile","desktop","cross-platform"],"product_types":["design-system","native-app"],"industries":["technology","general"],"archetypes":["platform-native"],"density":"adaptive","color_modes":["adaptive"],"interaction_complexity":"high","evidence_quality":"high","publication_status":"review","rights_basis":"original-analysis-public-source","summary":"A platform-native system where semantic roles, adaptive appearance, clear hierarchy, and respect for user agency matter more than decorative consistency across every device.","signature_traits":["semantic dynamic color roles","platform-aware adaptation","purpose before decoration","legibility and accessibility as system behavior","strong continuity with native controls"],"best_for":["native Apple-platform products","cross-device products that should feel at home on Apple hardware","interfaces where system behavior and accessibility should lead visual styling"],"avoid_for":["brand experiences that require ignoring platform conventions","visual clones that hard-code system colors or imitate native chrome without native behavior"]
}
